{
  "schema_version": 1,
  "kind": "batch",
  "batch_id": "liquidity_resilience_seed_v1",
  "campaign_id": "sfm_stream_001",
  "family_id": "liquidity_resilience",
  "generation": 0,
  "parent_batch_ids": [],
  "parent_experience_ids": [],
  "hypothesis_id": "spread_adjusted_depth_recovery",
  "objective": "Test spread-adjusted, multi-level and shock-recovery quote resilience variants before formal history.",
  "change_dimension": "operator_window_normalization_depth_lag_grid",
  "candidate_ids": ["liquidity_resilience_spread_adjusted_depth_recovery_w16", "liquidity_resilience_spread_adjusted_depth_recovery_w32_lag0", "liquidity_resilience_spread_adjusted_depth_recovery_w64_lag1", "liquidity_resilience_spread_adjusted_depth_recovery_w128_lag2", "liquidity_resilience_multi_level_depth_recovery_w16_lag0", "liquidity_resilience_multi_level_depth_recovery_w32_lag0", "liquidity_resilience_multi_level_depth_recovery_w64_lag1", "liquidity_resilience_multi_level_depth_recovery_w128_lag2", "liquidity_resilience_shock_recovery_speed_w16_lag0", "liquidity_resilience_shock_recovery_speed_w32_lag0", "liquidity_resilience_shock_recovery_speed_w64_lag1", "liquidity_resilience_shock_recovery_speed_w128_lag2"],
  "search_policy": {"method": "mechanism_grid", "candidate_budget": 12},
  "created_at": "2026-08-26",
  "source_commit": "b8f67a5",
  "status": "generated"
}
