{
  "schema_version": 1,
  "kind": "batch",
  "batch_id": "l4_formal_history_next_v1_flow_pressure",
  "campaign_id": "sfm_stream_001",
  "family_id": "flow_pressure",
  "generation": 1,
  "parent_batch_ids": [
    "flow_pressure_seed_v1"
  ],
  "parent_experience_ids": [
    "experience_l4_formal_history_v3_flow_pressure"
  ],
  "hypothesis_id": "l4_flow_pressure_followup",
  "objective": "Test bounded L4 follow-up parameter and mechanism variants after portrait review without promotion or holdout access.",
  "change_dimension": "window_events_and_mechanism_variant",
  "candidate_ids": [
    "flow_pressure_l4g1_param_a",
    "flow_pressure_l4g1_param_b",
    "flow_pressure_l4g1_mechanism_a",
    "flow_pressure_l4g1_mechanism_b"
  ],
  "search_policy": {
    "method": "experience_variants",
    "candidate_budget": 4
  },
  "created_at": "2026-09-10",
  "source_commit": "676fc7a",
  "status": "proposed"
}
