{
  "schema_version": 1,
  "kind": "batch",
  "batch_id": "impact_efficiency_opening_v2",
  "campaign_id": "sfm_stream_001",
  "family_id": "impact_efficiency",
  "generation": 1,
  "parent_batch_ids": ["impact_efficiency_seed_v1"],
  "parent_experience_ids": [],
  "hypothesis_id": "impact_efficiency_opening_readiness",
  "objective": "Separate unsupported opening-auction price-response outputs from valid continuous-session measurements.",
  "change_dimension": "event_support_and_readiness_contract",
  "candidate_ids": [
    "impact_efficiency_signed_price_impact_w16_opening_v2",
    "impact_efficiency_signed_price_impact_w32_opening_v2",
    "impact_efficiency_signed_price_impact_w64_opening_v2",
    "impact_efficiency_signed_price_impact_w128_opening_v2",
    "impact_efficiency_mid_price_response_w16_opening_v2",
    "impact_efficiency_mid_price_response_w32_opening_v2",
    "impact_efficiency_mid_price_response_w64_opening_v2",
    "impact_efficiency_mid_price_response_w128_opening_v2",
    "impact_efficiency_ofi_response_w16_opening_v2",
    "impact_efficiency_ofi_response_w32_opening_v2",
    "impact_efficiency_absorption_divergence_w16_opening_v2",
    "impact_efficiency_absorption_divergence_w32_opening_v2"
  ],
  "search_policy": {"method": "readiness_contract", "candidate_budget": 12},
  "created_at": "2026-09-03",
  "source_commit": "ba56b4b",
  "status": "design_only"
}
