{
  "schema_version": 1,
  "kind": "batch",
  "batch_id": "book_imbalance_seed_v1",
  "campaign_id": "sfm_stream_001",
  "family_id": "book_imbalance",
  "generation": 0,
  "parent_batch_ids": [],
  "parent_experience_ids": [],
  "hypothesis_id": "standing_book_pressure_predicts_near_term_price_pressure",
  "objective": "Establish twelve signed quote-book pressure seeds and preserve their implemented semantics.",
  "change_dimension": "seed_grid",
  "candidate_ids": [
    "book_imbalance_weighted_depth_imbalance_w16_v0_lag0",
    "book_imbalance_microprice_displacement_w32_v0_lag1",
    "book_imbalance_spread_conditioned_imbalance_w64_v0_lag2",
    "book_imbalance_weighted_depth_imbalance_w128_v1_lag0",
    "book_imbalance_microprice_displacement_w16_v1_lag1",
    "book_imbalance_spread_conditioned_imbalance_w32_v1_lag2",
    "book_imbalance_weighted_depth_imbalance_w64_v2_lag0",
    "book_imbalance_microprice_displacement_w128_v2_lag1",
    "book_imbalance_spread_conditioned_imbalance_w16_v2_lag2",
    "book_imbalance_weighted_depth_imbalance_w32_v3_lag0",
    "book_imbalance_microprice_displacement_w64_v3_lag1",
    "book_imbalance_spread_conditioned_imbalance_w128_v3_lag2"
  ],
  "search_policy": {
    "method": "mechanism_grid",
    "candidate_budget": 12
  },
  "created_at": "2026-08-26",
  "source_commit": "b455935",
  "status": "pilot_complete"
}
