{
  "batch_id": "market_microstructure_round_001",
  "campaign_id": "sfm_stream_002",
  "candidate_ids": [
    "counterfactual_depth_fragility_shock10_v1",
    "counterfactual_depth_fragility_shock25_v1",
    "trade_pair_parent_size_mismatch_volume_weighted_v1",
    "trade_pair_parent_size_mismatch_equal_weight_v1",
    "resting_order_commitment_survival_age_weighted_v1",
    "resting_order_commitment_survival_no_age_v1",
    "cancel_execution_divergence_separate_norm_v1",
    "cancel_execution_divergence_joint_norm_v1",
    "execution_shock_replenishment_order_elasticity_v1",
    "execution_shock_replenishment_quote_elasticity_v1",
    "distinct_aggressor_run_surprisal_markov_v1",
    "distinct_aggressor_run_surprisal_marginal_v1"
  ],
  "change_dimension": "mechanism_and_single_variable_control",
  "created_at": "2026-09-13",
  "family_id": "market_microstructure",
  "generation": 0,
  "hypothesis_id": "market_microstructure_causal_structure_round_001",
  "kind": "batch",
  "objective": "Test six causal market-microstructure mechanisms with one representative and one single-variable control each.",
  "parent_batch_ids": [],
  "parent_experience_ids": [],
  "schema_version": 1,
  "search_policy": {
    "candidate_budget": 12,
    "method": "mechanism_grid"
  },
  "source_commit": "624eed9",
  "status": "pilot_complete"
}
