{
  "schema_version": 1,
  "kind": "batch",
  "batch_id": "impact_efficiency_seed_v1",
  "campaign_id": "sfm_stream_001",
  "family_id": "impact_efficiency",
  "generation": 0,
  "parent_batch_ids": [],
  "parent_experience_ids": [],
  "hypothesis_id": "signed_price_impact_efficiency",
  "objective": "Prove the trade-price response vertical slice before expanding the family.",
  "change_dimension": "representative_vertical_slice",
  "candidate_ids": ["impact_efficiency_signed_price_impact_w16"],
  "search_policy": {"method": "mechanism_grid", "candidate_budget": 1},
  "created_at": "2026-08-26",
  "source_commit": "aba369b",
  "status": "generated"
}
